{
  "schemaVersion": "workprint-profile/0.1",
  "profile": "goal-delta",
  "title": "Goal Delta · Intake lab-mainline",
  "sourceRevision": "lab-mainline.r3-d9391c3af385..lab-mainline.r5-39d9a6fe9ff6",
  "sources": [
    {
      "id": "contract-before",
      "label": "Intake lab-mainline",
      "revision": "lab-mainline.r3-d9391c3af385"
    },
    {
      "id": "contract-after",
      "label": "Intake lab-mainline",
      "revision": "lab-mainline.r5-39d9a6fe9ff6"
    }
  ],
  "findings": [
    {
      "id": "goal-delta-lab-mainline-R001",
      "kind": "contract-change",
      "verdict": "changed",
      "subject": "lab-mainline-R001 · Reviewed requirement lab-mainline-R001",
      "sourceRefs": [
        "contract-before",
        "contract-after"
      ],
      "affectedEvidenceIds": [
        "AC-COVERAGE/tests"
      ]
    },
    {
      "id": "goal-delta-lab-mainline-R002",
      "kind": "contract-change",
      "verdict": "unchanged",
      "subject": "lab-mainline-R002 · Reviewed requirement lab-mainline-R002",
      "sourceRefs": [
        "contract-before",
        "contract-after"
      ],
      "affectedEvidenceIds": []
    }
  ],
  "summary": {
    "headline": "1 contract change; 2 proof lines are currently usable under the target comparison.",
    "counts": {
      "added": 0,
      "removed": 0,
      "changed": 1,
      "unchanged": 1,
      "affectedEvidence": 1,
      "newlyStaleEvidence": 0,
      "usableEvidence": 2,
      "rerunEvidence": 0,
      "retireEvidence": 0,
      "uncoveredAddedItems": 0
    }
  }
}
